url,title,part_id,brand,availability,price,symptoms,product_types,installation_difficulty,installation_time,related_parts,replacement_parts,video_url,description,rating
https://www.partselect.com/PS429667-Frigidaire-240311501-Door-Shelf-Retainer-Bar-End-Cap-Left-Side.htm?SourceCode=18,Door Shelf Retainer Bar End Cap - Left Side 240311501,PS429667,Frigidaire,In Stock,10.62,N/A,Refrigerator.,Really Easy,Less than 15 mins,N/A,"AP2115699,  868747,  240311501,  240311501",https://www.youtube.com/watch?v=KnDUARVaRtc,"This is a replacement end cap for your freezer or refrigerator shelf retainer bar. You will need a flat blade screwdriver to complete this repair. To replace this part, remove the retainer bar by popping the end caps out of place. Use the screwdriver to pop out the individual end cap you are replacing. Secure the new one in place with the locking tabs and re-insert the retainer bar."
https://www.partselect.com/PS16662680-LG-MAN64890501-Door-Bin-Shelf.htm?SourceCode=18,Door Bin Shelf MAN64890501,PS16662680,LG,In Stock,54.86,N/A,Refrigerator.,N/A,N/A,N/A,N/A,https://www.youtube.com/watch?v=d6AvOkulk_g,"This door basket, also known as a door shelf or door bin, is compatible with LG refrigerators. It is an authentic manufacturer replacement part, sourced directly from LG. It is made of clear plastic and it hooks into place on the inside of the fridge door. The door basket is perfect for storing bottles and jars in an organized manner. Over time, it is common for the door basket to become discolored, warped, or cracked. It is recommended to replace it in order to continue storing your items safely. Each door basket is sold individually."
https://www.partselect.com/PS429668-Frigidaire-240311502-Door-Shelf-Retainer-Bar-End-Cap-Right-Side.htm?SourceCode=18,Door Shelf Retainer Bar End Cap - Right Side 240311502,PS429668,Frigidaire,In Stock,10.62,N/A,Refrigerator.,Really Easy,Less than 15 mins,N/A,"AP2115700,  868748,  240311502,  240311502",https://www.youtube.com/watch?v=GnGwaIUImI0,"This replacement bar end cap can be used for a shelf in your freezer. The end cap is 4.25 inches long and 2.4 inches wide. You may need a flat blade screwdriver in order to pop out the existing end cap. Slide the new cap in place, making sure the locking tab is secure, and replace the bar."
https://www.partselect.com/PS11738927-Whirlpool-WP2156003-Door-Shelf-Retainer-Bar-End-Cap.htm?SourceCode=18,Door Shelf Retainer Bar End Cap WP2156003,PS11738927,Whirlpool,In Stock,10.62,N/A,Refrigerator.,Very Easy,Less than 15 mins,N/A,"AP6005865,  2156003",https://www.youtube.com/watch?v=7JgRFQI2QEs,"The door shelf retainer bar end cap connects to the retainer bar on your refrigerator’s door shelf, and attaches it to the refrigerator door. If your shelf retainer bar has become disconnected, a damaged end cap could be the cause. To remove the end cap, first unhook the release tab on both ends of the retainer bar. Slide out the bar and the end caps, and slide out the defective cap. Now, simply replace the end cap and snap the bar with end caps back in place on the refrigerator door. This part is made of white plastic and is sold individually."
https://www.partselect.com/PS10066452-LG-MAN62749601-Door-Bin.htm?SourceCode=18,Door Bin MAN62749601,PS10066452,LG,In Stock,109.12,N/A,Refrigerator.,Very Easy,Less than 15 mins,N/A,AP5957271,https://www.youtube.com/watch?v=d6AvOkulk_g,"This door bin, also known as a door basket, is an authentic manufacturer replacement part made for your LG fridge. It is made of clear plastic and it fits on to mounting brackets inside of the door fridge. The door bin provides storage for various food items such as condiments, bottles, and jars. If door bin cracks or breaks you will need to replace it to avoid falling food items and potential damage to the door frame."
https://www.partselect.com/PS422444-Frigidaire-215267701-Door-Shelf-End-Cap-Left-or-Right-Side.htm?SourceCode=18,Door Shelf End Cap - Left or Right Side 215267701,PS422444,Frigidaire,In Stock,7.71,N/A,Refrigerator.,Really Easy,15 - 30 mins,N/A,"AP2110843,  444,  215267701",https://www.youtube.com/watch?v=jivKTK44sAo,"This end cap can be used for the right or left side of the refrigerator door shelf or the freezer door shelf. It is white in color, made of plastic material and measures about 2 inches high by 3 inches deep. This might need to be replaced if it has broken or worn over time. This repair requires no tools. You will need to open your fridge, pull upwards on the existing end cap, and pull outwards. There is a locking tab on either end so it does not matter if the top or bottom comes out first. Slide the new end cap onto the rail and it is installed."
https://www.partselect.com/PS7794183-LG-MAN62570401-Door-Bin-Shelf.htm?SourceCode=18,Door Bin Shelf MAN62570401,PS7794183,LG,In Stock,114.86,N/A,Refrigerator.,N/A,N/A,N/A,N/A,https://www.youtube.com/watch?v=d6AvOkulk_g,"This door basket, commonly referred to as a door shelf, is a genuine OEM replacement part designed for use in LG refrigerators. It is a translucent, plastic shelf that is positioned on the inside of the fridge door. It provides a convenient space to store your food items and containers. The door shelf should be replaced if it is cracked, warped, or can no longer remain attached to the door. A faulty door shelf may cause your food items to fall and break and it may damage the interior of the fridge. Each door shelf is sold separately. You do not need fasteners to mount the shelf."
https://www.partselect.com/PS16729788-GE-WR71X38307-Door-Shelf-Bin.htm?SourceCode=18,Door Shelf Bin WR71X38307,PS16729788,GE,In Stock,46.35,N/A,Refrigerator.,Easy,30 - 60 mins,N/A,WR71X30144,https://www.youtube.com/watch?v=d6AvOkulk_g,"This door shelf bin is a genuine OEM replacement part designed for refrigerators. It is made of highly durable clear plastic, which allows users to easily view the contents of the bin. The bin is a storage compartment used to hold various items such as bottles, jars, and condiments. It provides a convenient way to store and organize food items for easy access. The bin is vulnerable to breakage, discoloration, and warping over time. The bin may also fail due to overloading or accidental impacts. Do not place any items in the bin if it is damaged as this may result in accidental spills and damage to the interior components of the refrigerator. No mounting hardware is needed for this repair."
https://www.partselect.com/PS976767-Frigidaire-241511701-Door-Bin-Clear.htm?SourceCode=18,Door Bin - Clear 241511701,PS976767,Frigidaire,In Stock,50.30,N/A,Refrigerator.,Really Easy,Less than 15 mins,N/A,"AP3770692,  1056498,  241511703,  241511704,  241511705,  241808207,  241808208,  241808209,  241808216,  241808217,  241808218,  241808224,  241808225,  241808232,  7241808209,  7241808218",https://www.youtube.com/watch?v=d6AvOkulk_g,Sold individually.
https://www.partselect.com/PS426768-Frigidaire-216730700-Defrost-Heater.htm?SourceCode=18,Defrost Heater 216730700,PS426768,Frigidaire,In Stock,72.91,Frost buildup,"Freezer, Refrigerator.",N/A,N/A,N/A,"AP2113768,  890572,  297216100,  297216101,  7216730700,  7297216100",https://www.youtube.com/watch?v=d6AvOkulk_g,This part is located at the bottom of the evaporator.  The defrost heater heats the evaporator in the defrost mode of operation to keep the cooling coils from frosting over. The thermostat must be replaced when replacing the defrost heater.
https://www.partselect.com/PS11756814-Whirlpool-WPW10624451-FLIPPER-MULLION-Assembly-COMPL-XL.htm?SourceCode=18,FLIPPER MULLION Assembly COMPL XL WPW10624451,PS11756814,Whirlpool,In Stock,83.55,Door won’t open or close,Refrigerator.,Really Easy,Less than 15 mins,N/A,"W10434693,  W10448918,  W10624451",https://www.youtube.com/watch?v=d6AvOkulk_g,"The white mullion flipper creates an airtight seal between the doors of French-door refrigerators, ensuring that cool air stays inside and moisture does not accumulate. This replacement part helps maintain the fridge’s efficiency. Always disconnect the power and verify the part is compatible with your model before installation."
https://www.partselect.com/PS6883666-GE-WR51X10132-Refrigerator-Defrost-Heater-Fresh-Food.htm?SourceCode=18,Refrigerator Defrost Heater Fresh Food WR51X10132,PS6883666,GE,In Stock,47.97,Fridge too warm,"Refrigerator, Range.",N/A,N/A,N/A,AP5669525,https://www.youtube.com/watch?v=fb8iz56hcEo,N/A
https://www.partselect.com/PS2369212-Frigidaire-5303918410-Defrost-Heater.htm?SourceCode=18,Defrost Heater 5303918410,PS2369212,Frigidaire,In Stock,86.28,Freezer not defrosting | Fridge too warm,Refrigerator.,N/A,N/A,N/A,"AP4455011,  75303918410",N/A,N/A
https://www.partselect.com/PS303781-GE-WR51X10055-Defrost-Heater-and-Bracket-Assembly.htm?SourceCode=18,Defrost Heater and Bracket Assembly WR51X10055,PS303781,GE,In Stock,76.90,Fridge too warm | Freezer not defrosting | Freezer section too warm | Frost buildup,Refrigerator.,Easy,30 - 60 mins,N/A,"AP3183311,  914088,  WR51X10055,  WR51X10030",https://www.youtube.com/watch?v=d6AvOkulk_g,The defrost heater keeps the cooling coils from frosting over. The heater will get hot and melt any ice or frost build up around the coils.
https://www.partselect.com/PS11738607-Whirlpool-WP12729128-DEFROST-HEATER.htm?SourceCode=18,DEFROST HEATER WP12729128,PS11738607,Whirlpool,In Stock,71.73,Freezer not defrosting | Frost buildup | Fridge too warm,Refrigerator.,N/A,N/A,N/A,"AP6005557,  12729128",https://www.youtube.com/watch?v=DTDJYrvrQjs,N/A
https://www.partselect.com/PS11770079-Whirlpool-W10919199-Grid-Cutter-Assembly.htm?SourceCode=18,Grid Cutter Assembly W10919199,PS11770079,Whirlpool,In Stock,236.46,N/A,"Ice Maker, Refrigerator.",N/A,N/A,N/A,"W10485968,  W10783275",https://www.youtube.com/watch?v=d6AvOkulk_g,"Part Number W10919199 is an OEM part for Whirlpool ice machines. It is responsible for slicing the ice into uniform cubes after the ice has formed in the ice maker's mold. If your ice cubes are irregularly shaped or not being cut properly, this component may need replacement."
https://www.partselect.com/PS3504321-Frigidaire-242044008-Defrost-Heater.htm?SourceCode=18,Defrost Heater 242044008,PS3504321,Frigidaire,In Stock,28.08,Freezer not defrosting | Frost buildup | Fridge too warm,Refrigerator.,Really Easy,15 - 30 mins,N/A,242044020,https://www.youtube.com/watch?v=d6AvOkulk_g,The defrost heater is in the evaporator section at the rear of the freezer. This heater melts frost off of the evaporator coils.
https://www.partselect.com/PS1993872-GE-WR51X10101-Defrost-Heater-Harness-Kit.htm?SourceCode=18,Defrost Heater Harness Kit WR51X10101,PS1993872,GE,In Stock,54.67,Fridge too warm | Freezer section too warm | Freezer not defrosting | Freezer too cold,Refrigerator.,Really Easy,30 - 60 mins,N/A,"AP4355467,  1399613,  WR51X10101,  WR51X10032,  WR51X10053,  WR51X10097",https://www.youtube.com/watch?v=32dvdtzVxRY,This dual heater kit replaces the single heater. It's redesigned to use two heating elements for a better defrost cycle.
https://www.partselect.com/PS2340319-GE-WR17X12591-Mullion-Articulation-Assembly.htm?SourceCode=18,Mullion Articulation Assembly WR17X12591,PS2340319,GE,In Stock,178.54,Door won’t open or close,Refrigerator.,Really Easy,Less than 15 mins,N/A,"AP4363643,  1477374,  WR17X12591,  WR17X12591,  WR17X12596",https://www.youtube.com/watch?v=d6AvOkulk_g,Also known as a mullion heater. This mullion rail is white in colour. The door mullion rail creates an airtight seal between the doors on a French door refrigerator.
https://www.partselect.com/PS11755733-Whirlpool-WPW10503278-Electronic-Control-Board.htm?SourceCode=18,Electronic Control Board WPW10503278,PS11755733,Whirlpool,In Stock,197.38,Fridge too warm | Freezer not defrosting | Will Not Start | Fridge too cold,Refrigerator.,Easy,30 - 60 mins,N/A,"AP6022400,  12002339,  12002445,  12002449,  12002508,  12002509,  12002567,  12002706,  12784415,  12784415V,  12868502,  12868510,  12868513,  67003867,  67004453,  67004496,  67004907,  67005043,  67005280,  67005281
                        
                            ...
                            Show more
                        
                        , 67006034,  67006209,  67006214,  67006216,  67006226,  67006712,  67006740,  8208187,  W10165748,  W10503278
                         Show less",https://www.youtube.com/watch?v=aqptKoBxRyU,"The electronic control board is used in refrigerators to monitor and manage the temperature settings, such as cooling or defrosting times. If your fridge or freezer is too warm, too cold, is not defrosting, will not start, and/or runs too long then replacing the control board could solve your appliance problem. The tools needed for this installation project is a small flat blade screwdriver. *Please note: the board will need to be programmed after installation. Remember to unplug refrigerator from power source as a safety precaution. Refer to the manual provided by the manufacturer for further installation instructions and accurate guidance."
https://www.partselect.com/PS17215831-Whirlpool-W11658802-ICE-MAKER-ASSY-LP.htm?SourceCode=18,ICE MAKER ASSY-LP W11658802,PS17215831,Whirlpool,In Stock,105.23,Ice maker not making ice | Ice maker won’t dispense ice,Refrigerator.,N/A,N/A,N/A,"W10746960,  W10917790,  W11109572,  W11188383,  W11232541,  W11294907,  W11457039,  W11483245,  W11485529,  W11554919,  W11579560",https://www.youtube.com/watch?v=d6AvOkulk_g,The ice maker includes the ice mold and the control device. The ice maker receives water from the water inlet valve and then holds the water in the ice mold until the water freezes solid.
https://www.partselect.com/PS17645341-GE-WR55X45225-PCBA-AGATHOS-2021-STD.htm?SourceCode=18,PCBA AGATHOS 2021 STD WR55X45225,PS17645341,GE,In Stock,101.47,Not dispensing water,Refrigerator.,Really Easy,15 - 30 mins,N/A,"WR55X23724,  WR55X24388,  WR55X26258,  WR55X30486,  WR55X41025",N/A,N/A
https://www.partselect.com/PS423802-Frigidaire-215846604-Defrost-Timer-120V-60Hz.htm?SourceCode=18,Defrost Timer - 120V 60Hz 215846604,PS423802,Frigidaire,In Stock,32.93,Fridge too warm | Freezer not defrosting | Fridge and Freezer are too warm | Will Not Start,"Refrigerator, Freezer.",Easy,1- 2 hours,N/A,"AP2592907,  442754,  08000035,  08003824,  08011620,  241809401,  241809402,  29811-3,  3001268,  3007400,  5300541134,  5300800692,  5303007400,  5308000035,  5308003824,  54113-1,  54113-4,  55448-3,  55448-4,  55467-1
                        
                            ...
                            Show more
                        
                        , 8000035,  8003824,  8011620,  F111695,  F111812,  G000158274,  G000158291,  G000173814,  G000187005,  G000187464,  G158274,  G158291,  G163818,  G169069,  G173814,  G174820,  G174821,  G178820,  G185160,  G187464,  K1224661,  K1224662,  K1226501,  K1226502,  K1227229,  K1227920,  K1227927,  K1228104,  K1228105,  K1230354,  K1230534,  K1233374,  K1233375,  NR00422503,  R000422503,  R000900129,  R422503,  W188C189A06,  W188C189A07,  WR422503
                         Show less",https://www.youtube.com/watch?v=d6AvOkulk_g,"This defrost timer is designed for use in your refrigerator. The defrost timer acts as a clock, that switches the refrigerator from the freezing cycle to the defrost cycle and back. If your refrigerator is running non-stop, or is not running at all, you may need to check and replace the defrost timer. This is a 6 hour and 21 minute defrost timer. This part is made of white plastic, with 4 metal prongs protruding from one end. To complete this repair, you will need to access the old defrost timer which is located inside the console on the roof of your refrigerator. To complete this repair, you will need a 1/4-inch nut driver, a flat blade screwdriver, and a Phillips screwdriver. Be sure to disconnect power from your refrigerator before you begin this repair."
https://www.partselect.com/PS11752535-Whirlpool-WPW10310240-Electronic-Control.htm?SourceCode=18,Electronic Control WPW10310240,PS11752535,Whirlpool,In Stock,277.24,Will Not Start,Refrigerator.,Really Easy,15 - 30 mins,N/A,"AP6019229,  12920717SP,  12920719SP,  12920721,  12920724,  W10162662,  W10164420,  W10164422,  W10165854,  W10191108,  W10213583,  W10310240",https://www.youtube.com/watch?v=d6AvOkulk_g,"This electronic board manages and monitors the cooling and defrost times of your refrigerator and other functions. If your refrigerator is not cooling properly because the dispenser is flapping between open or closed positions, or there are problems with the display lights flashing, replacing your control board can be the solution. Remember to unplug your refrigerator from the power source before beginning this installation project. Refer to the manual provided by the manufacturer for installation instructions and accurate guidance."
https://www.partselect.com/PS11723171-Whirlpool-W10822278-Defrost-Timer.htm?SourceCode=18,Defrost Timer W10822278,PS11723171,Whirlpool,In Stock,32.93,Fridge too warm | Freezer not defrosting | Freezer section too warm | Leaking,"Refrigerator, Freezer.",Easy,30 - 60 mins,N/A,"AP5985208,  0053736,  0055525,  0056627,  0056768,  0056906,  0056907,  0057052,  0311209,  104039,  1101021,  1105267,  1113225,  1114246,  1114248,  1114264,  1114283,  1114287,  1115416,  1118626
                        
                            ...
                            Show more
                        
                        , 1127570,  1127571,  1127591,  14210016,  1530557,  1548140,  1549238,  1549252,  1549256,  1833663,  1850019,  1850038,  20009000,  20009023,  20009037,  20103015,  20142257,  20143568,  20144431,  20144520,  2149098,  2154665,  2154666,  2154912,  2154982,  2154983,  2154984,  2162046,  2162347,  2172691,  2176335,  2176340,  2176646,  2176648,  2188371,  2188372,  2188375,  2188376,  2193084,  2199008,  4210521,  4210579,  4210778,  4318057,  4339497,  4339856,  4343354,  4343402,  4356929,  4389238,  480561,  482489,  482493,  483212,  511883,  513588,  513590,  513629,  513630,  530213,  530214,  530557,  530558,  531714,  54113-3,  54113001,  548044,  548121,  548140,  548709,  549090,  549091,  549238,  549239,  549252,  549253,  549256,  549257,  549875,  549876,  56906,  798629,  8133,  833531,  833663,  833757,  833795,  833840,  850019,  850038,  850343,  850344,  850345,  850608,  850609,  850694,  850695,  850731,  850845,  850847,  850878,  850879,  851061,  851106,  851160,  851161,  851200,  851269,  851406,  851701,  851971,  938035,  940074,  943428,  943434,  943435,  943436,  945486,  945512,  945513,  945514,  978266,  978472,  989280,  989281,  D70041-12,  D7004112,  FSP482493,  R0950029,  R0950217,  W10740039,  W10822278VP,  Y0053736,  Y0055525,  Y0056627,  Y0056768,  Y0056906,  Y0311209
                         Show less",https://www.youtube.com/watch?v=sid2K9W_ums,"The Defrost Timer (Defrost control) acts like a clock by switching on the defrost heater circuit after a predetermined amount of compressor run time. This allows the defrost circuit to clear the evaporator of ice or frost to maintain proper airflow. If this part is not working, it can lead to temperature increases in your refrigerator. If the compressor circuit fails, no cooling will take place; if the defrost circuit isn't activated, ice will quickly build up on the evaporator coils and reduce airflow and efficiency. If the timer doesn't advance or if the contacts have no continuity, the timer will need to be replaced. This part is located inside of the control housing on most models, and is approximately 3 inches long and 2.5 inches wide. This part is constructed of plastic and metal, and comes in white. It features 1 defrost timer, along with all necessary mounting hardware and installation instructions"
https://www.partselect.com/PS310869-GE-WR9X502-Defrost-Timer-120V-60Hz.htm?SourceCode=18,Defrost Timer - 120V 60Hz WR9X502,PS310869,GE,In Stock,68.11,Fridge too warm | Freezer section too warm | Freezer not defrosting | Fridge and Freezer are too warm,"Refrigerator, Freezer.",Easy,15 - 30 mins,N/A,"AP2061708,  310900,  WR9X502,  CC310,  CC806,  SWR9X387,  SWR9X412,  SWR9X413,  WR09X0278,  WR09X0283,  WR09X0313,  WR09X0329,  WR09X0334,  WR09X0342,  WR09X0350,  WR09X0364,  WR09X0409,  WR09X0418,  WR09X0438,  WR09X0470
                        
                            ...
                            Show more
                        
                        , WR09X0479,  WR09X0481,  WR09X0484,  WR09X0487,  WR09X0526,  WR09X10049,  WR09X5161,  WR09X5162,  WR09X5163,  WR09X5164,  WR09X5192,  WR09X5202,  WR9X10049,  WR9X278,  WR9X283,  WR9X313,  WR9X329,  WR9X334,  WR9X339,  WR9X342,  WR9X350,  WR9X356,  WR9X363,  WR9X364,  WR9X366,  WR9X369,  WR9X375,  WR9X376,  WR9X387,  WR9X408,  WR9X409,  WR9X412,  WR9X413,  WR9X414,  WR9X418,  WR9X419,  WR9X428,  WR9X432,  WR9X436,  WR9X438,  WR9X453,  WR9X464,  WR9X465,  WR9X466,  WR9X468,  WR9X470,  WR9X471,  WR9X478,  WR9X479,  WR9X481,  WR9X484,  WR9X486,  WR9X487,  WR9X490,  WR9X495,  WR9X503,  WR9X504,  WR9X512,  WR9X5127,  WR9X5161,  WR9X5162,  WR9X5163,  WR9X5164,  WR9X5192,  WR9X5202,  WR9X5204,  WR9X5211,  WR9X5225,  WR9X526,  WR9X528,  WR9X576,  WR9X594
                         Show less",https://www.youtube.com/watch?v=TABAFjm27qI,"This defrost timer will cycle for 25 minutes after every six hours of run time. The timer itself is made of plastic, and its terminals are bent, the leads are internal, and the label is orange. If you notice that your fridge is too warm, the fridge is running for a long time or is leaking, it could be due to the defrost timer becoming inactive. The defrost timer is found underneath the light cover (may need to remove lightbulb) and will need to be removed along with the air inlet assembly and housing."
https://www.partselect.com/PS11752593-Whirlpool-WPW10312695-Main-Electronic-Control-Board.htm?SourceCode=18,Main Electronic Control Board WPW10312695,PS11752593,Whirlpool,In Stock,205.62,Will Not Start,Refrigerator.,Really Easy,15 - 30 mins,N/A,"AP6019287,  W10312695",https://www.youtube.com/watch?v=d6AvOkulk_g,"The refrigerator main control board is a critical component that manages essential functions like cooling and defrosting, ensuring the appliance operates efficiently and reliably. This genuine OEM replacement part is compatible with select models, providing a dependable solution for maintaining your refrigerator. Always unplug the appliance and wear protective gloves during installation for safety. This main electronic control board serves as the central system for your refrigerator, regulating key functions such as temperature control and defrost cycles. Designed for specific models, this authentic OEM part ensures smooth operation and reliable performance. Before purchasing, verify compatibility with your appliance model to ensure the correct fit."
https://www.partselect.com/PS423801-Frigidaire-215846602-Defrost-Timer-60Hz-120V.htm?SourceCode=18,Defrost Timer - 60Hz 120V 215846602,PS423801,Frigidaire,In Stock,36.81,Fridge too warm | Freezer not defrosting | Freezer section too warm | Will Not Start,Refrigerator.,Easy,30 - 60 mins,N/A,"AP2111929,  12762,  215846602,  00624728,  00626234,  00628510,  00628518,  0628510,  08000559,  08006054,  08006992,  08016919,  08950148,  174820,  187484,  215267800,  215846605,  215846606,  240371001,  241621501
                        
                            ...
                            Show more
                        
                        , 3001671,  3001701,  3015909,  3203657,  4013391050,  5300187484,  5300628518,  5301090474,  5303203657,  5303211155,  5303211680,  5303270622,  5303275811,  5303321133,  5303321915,  5304457327,  5308006054,  5308006992,  624728,  626234,  628510,  628518,  8000559,  8006054,  8016919,  8950148,  C000062797,  C62797,  D007004112,  DG187005,  F000111695,  G000187484,  G172706,  G186580,  G187005,  G187484,  M1090167,  M1090474,  N8000559,  R000900241,  R000900764,  R900241
                         Show less",https://www.youtube.com/watch?v=kKYvssvclvA,"This Defrost Timer works like a clock by switching on the defrost heater circuit after a predetermined amount of compressor run time. This allows the defrost circuit to clear the evaporator of ice or frost to maintain proper airflow. The defrost timer is located in the control housing which is in the refrigerator section of your appliance. If this part is not working, it can lead to temperature increases in your refrigerator. If the compressor circuit fails, no cooling will take place; if the defrost circuit isn't activated, ice will quickly build up on the evaporator coils and reduce airflow and efficiency. If the timer doesn't advance or if the contacts have no continuity, the timer will need to be replaced. This timer measures approximately 3 inches long and 2.5 inches wide, and is constructed of plastic and metal. It comes in black/white/silver and is sold individually. This replacement part features 1 defrost timer."
https://www.partselect.com/PS11755867-Whirlpool-WPW10515058-LED-Light-Control-Board.htm?SourceCode=18,LED Light Control Board WPW10515058,PS11755867,Whirlpool,In Stock,33.90,Light not working,Refrigerator.,Really Easy,Less than 15 mins,N/A,"AP6022534,  W10465957,  W10515058,  W10522611,  WPW10515058VP",https://www.youtube.com/watch?v=d6AvOkulk_g,"This 2-plug LED light control board is a genuine OEM replacement part designed for refrigerators. It fits into the fresh food section of the refrigerator. The LED light helps users easily see the contents of the fridge, even in low-light conditions. LED lights are a popular choice due to their energy efficiency, longer lifespan, and ability to produce bright and consistent lighting. Compared to traditional incandescent or fluorescent lights, LED lights consume less energy, generate less heat, and have a much longer operational lifespan, making them a preferred choice-"
