url,title,part_id,brand,availability,price,symptoms,product_types,installation_difficulty,installation_time,related_parts,replacement_parts,video_url,description,rating
https://www.partselect.com/PS12365992-Frigidaire-5304515677-Screw-Kit-of-Four.htm?SourceCode=18,Screw - Kit of Four 5304515677,PS12365992,Frigidaire,In Stock,14.50,N/A,Refrigerator.,Really Easy,Less than 15 mins,N/A,"AP6333077,  137087200,  240383401,  240383406,  7240383406",https://www.youtube.com/watch?v=d6AvOkulk_g,This screw is used in refrigerators. The screw can be loosened or tightened with a Phillips-head or square-head screwdriver. This screw is used to secure the refrigerator handle to the refrigerator door. This is an OEM part sourced directly from the manufacturer.
https://www.partselect.com/PS11757021-Whirlpool-WPW10661886-Screw.htm?SourceCode=18,Screw WPW10661886,PS11757021,Whirlpool,In Stock,10.62,N/A,"Refrigerator, Freezer, Dryer.",Really Easy,15 - 30 mins,N/A,"AP6023675,  W10303465,  W10460893,  W10661886,  WPW10661886VP",https://www.youtube.com/watch?v=d6AvOkulk_g,"This mounting screw is a genuine OEM replacement part for the door handle in your refrigerator. If you are having trouble shutting the refrigerator door, or opening it, replacing this screw can help solve the issue. Replacing this part is easy and requires minimal disassembly of the refrigerator end cap handle. Your will need a screwdriver to complete this repair."
https://www.partselect.com/PS11746909-Whirlpool-WP9703438-Retaining-Ring.htm?SourceCode=18,Retaining Ring WP9703438,PS11746909,Whirlpool,In Stock,6.74,Noisy,"Mixer, Dryer, Refrigerator, Washer Dryer Combo.",Easy,1- 2 hours,N/A,"AP6013682,  4-10233,  410233,  4176072,  65100-1,  9703438,  WP9703438VP",https://www.youtube.com/watch?v=vgd9B9CFRx4,"This part is a retaining ring, sometimes called a retaining clip, that holds the drum support roller onto the shaft of a dryer. It is made entirely of metal and measures less than an inch in diameter. The retaining ring is a genuine OEM part sourced directly from the manufacturer. The ring may vary in appearance due to manufacturer substitution, but the function is the same. You may need to replace this part if the dryer is noisy during tumbling, will not tumble, or takes too long to dry. Be sure to check drum support roller kit and shaft before ordering parts."
https://www.partselect.com/PS8752913-LG-MJB63190001-Handle-Screw.htm?SourceCode=18,Handle Screw MJB63190001,PS8752913,LG,In Stock,12.56,N/A,"Refrigerator, Freezer.",Very Easy,Less than 15 mins,N/A,"AP5787341,  4620JJ2010C,  4620JJ2010J,  MJB63189701,  MJB63190006",https://www.youtube.com/watch?v=d6AvOkulk_g,"This handle screw, also known as a mounting bolt, is a mounting screw to help secure the door handle to your refrigerator door. If your handle is loose, you may just need to tighten the screw. If your screw is missing or broken, it may need to be replaced. There are multiple handle screws on your fridge, please consider ordering extra as they commonly wear at the same rate. This is about 1 inch long and metallic in color."
https://www.partselect.com/PS12364857-Frigidaire-5304511738-LIGHT-BULB.htm?SourceCode=18,LIGHT BULB 5304511738,PS12364857,Frigidaire,In Stock,60.75,N/A,Refrigerator.,Easy,1- 2 hours,N/A,"AP6278388,  241560701",https://www.youtube.com/watch?v=d6AvOkulk_g,"This is an LED light for your refrigerator. This LED light is used to illuminate and provide ample light to the interior of your refrigerator and its freezer compartment. If the light bulb currently in your refrigerator is dying and has become significantly dimmer over time, it should be replaced immediately. This LED bulb is rated for 3.5W and can be replaced easily, by simply unscrewing the old bulb, and screwing in the new one. This bulb is sold individually and does not come with any other parts or accessories."
https://www.partselect.com/PS17216393-Whirlpool-W11679940-40-WATT-REFRIGERATOR-BULB.htm?SourceCode=18,40 WATT REFRIGERATOR BULB W11679940,PS17216393,Whirlpool,In Stock,7.71,N/A,"Refrigerator, Freezer.",N/A,N/A,N/A,"2252970,  2255743,  2255743N,  2262009,  2311792,  2386,  2386-1,  31956-1,  4343345,  4343660,  4390465,  63001035,  67003568,  67003883,  68001557,  68001575,  68123-1,  8171221,  8208190,  88008545
                        
                            ...
                            Show more
                        
                        , 946059,  A0282801,  A0282810V,  A0282812,  W10194422,  W10194422V,  W10311505,  W10311505N
                         Show less",https://www.youtube.com/watch?v=d6AvOkulk_g,Substituted with part number PS869887.
https://www.partselect.com/PS16555201-Whirlpool-W11527432-LED-Light-Module.htm?SourceCode=18,LED Light Module W11527432,PS16555201,Whirlpool,In Stock,66.34,Light not working,Refrigerator.,Really Easy,15 - 30 mins,N/A,"W11101384,  W11245960,  W11333374,  W11387579",https://www.youtube.com/watch?v=d6AvOkulk_g,"This is an LED light module designed for use in refrigerators. This module features an LED light panel that is secured to the top portion of your refrigerator cabinet and shines light down when you open the appliance. If your current LED light is not turning on and/or is flickering or working intermittently, it needs to be replaced. Replacing this LED light panel is simple as it features a single power cable harness that connects inside your fridge, and a single screw to secure it. This LED light panel is sold individually and does not come with any other parts, such as its securing screw."
https://www.partselect.com/PS12751166-Frigidaire-316538904-Light-Bulb.htm?SourceCode=18,Light Bulb 316538904,PS12751166,Frigidaire,In Stock,23.23,N/A,"Refrigerator, Range, Wall Oven, Microwave Oven Combo.",Really Easy,15 - 30 mins,N/A,"08002735,  08037649,  08068090,  1144690,  171840,  173421,  20102226,  218926201,  2386-1,  240436701,  240436702,  241529103,  241552901,  241555401,  28078,  3001179,  3001180,  3013071,  3018801,  3051082
                        
                            ...
                            Show more
                        
                        , 3051513,  305595114,  316538901,  31956,  3201908,  3202007,  3205941,  37400050001,  374L001P01,  374L002P01,  374T012R01,  374T018P01,  374T018P04,  374T018P05,  374T020P01,  374T025P01,  51461,  5300063749,  5303001179,  5303013071,  5303051082,  5303208582,  5303285989,  5303299720,  5304406549,  5304448955,  55771,  5889938,  7241555401,  73213-1040,  73213104,  732131040,  732132000,  732132000@,  75303013071,  8002735,  8006-19,  8006-38-4,  8006-38-7,  8037649,  8063-2,  8068090,  8529,  902234,  AP067007,  C000501851,  F002009-000,  F4-21,  F51461,  F73317,  FA2009,  G10424,  G165723,  G185162,  G25806,  G28087,  G28178,  G30055,  G39122,  G54494,  K1027373,  K1027374,  K1081270,  K1101291,  K1134642,  K1135453,  K1137227,  K1144690,  K1168823,  K1186186,  K1227370,  M1088506,  M1088822,  M1090078,  P067007,  P067018,  Q000007422,  Q000007428,  Q000023556,  Q000063746,  Q000063749,  Q000198580,  Q63749,  QM000009D1,  R000900925,  R900925,  T1506945,  T357165,  WC501851,  WC501868
                         Show less",https://www.youtube.com/watch?v=7yE0ZZBNISU,"This OEM 40 watt appliance light bulb is used for some ranges, refrigerators, freezers, and microwaves. Simply locate the existing bulb, unscrew it from its socket, and replace with new light bulb. If the existing bulb is broken in the socket, disconnect the power to the refrigerator and use a pair of needle nose pliers to grip the internal fragments of the bulb to unscrew. Replace with the new bulb and reconnect the power to the refrigerator. These bulbs are sold individually and are a commonly replaced part; consider ordering a spare."
https://www.partselect.com/PS884734-Whirlpool-8009-Light-Bulb-40W.htm?SourceCode=18,Light Bulb - 40W 8009,PS884734,Whirlpool,In Stock,16.44,N/A,"Refrigerator, Range, Wall Oven, Dryer.",Really Easy,15 - 30 mins,N/A,"AP3607217,  1958,  8009,  0020478,  0020571,  0042175,  0047146,  0053950,  0056713,  0057030,  0057035,  0088673,  0089290,  03055001,  0311700,  040672-02,  05600070,  0B00300199,  0B00300299,  0B00300399
                        
                            ...
                            Show more
                        
                        , 0L01500199,  10664502,  10664503,  1077-202,  1077202,  14001021,  14201304,  14205456,  14206578,  14207674,  14211172,  14214978,  14903,  15199,  15779,  187,  19447,  19950037,  20100751,  20102977,  20478,  2252969,  2252970,  2255743,  2262969,  2311792,  233056,  2386,  2386001,  240673,  241006,  245388,  247591,  25916P01,  259957,  260929,  279666,  3-0909,  3-909,  300909,  304-3,  311255,  311255D,  31956,  31956-1,  31956A,  40A15,  41275,  4157019,  4159006,  4165252,  4165697,  4166357,  4169617,  4173062,  4211947,  42585,  4319603,  4324154,  4338591,  4355037,  4355534,  4355679,  4364092,  4371303,  4372020,  4389460,  4390465,  5-20021,  5-50733,  5-70019,  50062-3,  501358,  50302,  509602,  517949,  51945P01,  520021,  526949,  527949,  540611,  540614,  54494,  547949,  550733,  570019,  63001035,  67003883,  67003883A,  68001557,  68001575,  68123-1,  68123-2,  7-1159,  7-66096,  7-70121,  7-70852,  7-71133,  7-7319,  7-90064,  701159,  707319,  72001067,  7407P002-60,  7407P026-60,  7407P091-60,  7407P095-60,  7407P103-60,  7407P114-60,  766096,  770121,  770852,  771133,  786571,  786742,  790064,  8009,  816389,  816641,  8171221,  8208190,  837,  865000,  878122,  878937,  879350,  880010,  88008545,  8935,  93-0B-00300-19,  93-0B-00300-199,  976110,  98004498,  A0282801,  A0282803,  A0282803A,  A0282803Q,  A0282806,  A0282810,  A0282812,  A2828-3,  A282803,  JA99707319,  M9D1,  M9D37,  M9D49,  M9D51,  R0130419,  R0130884,  R0157675,  R0157818,  R0165001,  R0165007,  R0712010,  R0762002,  R0762003,  R0950124,  STD398091,  W10126566,  W10132113,  W10132131,  W10346855,  WB8T10022,  Y0020478,  Y0020571,  Y0042175,  Y0047146,  Y0053950,  Y0056713,  Y0057030,  Y0057035,  Y0088673,  Y0089290,  Y03055001,  Y0311700,  Y04067202,  Y05600070,  Y0B00300199,  Y0B00300299,  Y0B00300399,  Y0L01500199,  Y701159,  Y707319
                         Show less",https://www.youtube.com/watch?v=kSohIGunxBw,"This an authentic OEM 40-Watt replacement light bulb, used in a number of household appliances. It is specially designed to withstand extreme temperatures, which is why these replacement bulbs are most often used to light the inside of refrigerators and ranges. It features a standard socket base, which means you simply unscrew the burnt-out bulb and screw in the replacement. Depending on the appliance you may require a screwdriver or nut driver to access the light bulb. We recommend you wear work gloves while handling this replacement part. It is constructed of glass and metal and is sold individually. Depending on the appliance and location of the bulb within it, you may want to consider disconnecting power and using a flashlight for easier access to unscrewing and re-screwing in your bulb during this repair."
https://www.partselect.com/PS217532-GE-40A15-Light-Bulb-40W.htm?SourceCode=18,Light Bulb - 40W 40A15,PS217532,GE,In Stock,18.38,N/A,"Refrigerator, Range, Wall Oven, Microwave Oven Combo.",Really Easy,15 - 30 mins,N/A,"111257,  293547,  339665,  40A15-2PK,  40A15R,  40A15RVL,  40A15RVL1,  4324154,  4338591,  60A,  60A15RVL,  630610,  65973,  69651,  8004738,  8004883,  PM02X0001,  PM2X1,  PURLOCAL,  STD372401
                        
                            ...
                            Show more
                        
                        , STD372402,  WB02X3551,  WB08T10022,  WB2X3551,  WR02X12289,  WR02X12327,  WR02X12328,  WR02X12530,  WR02X12594,  WX04X0010,  WX12X0020,  WX12X0109,  WX12X109,  WX12X1106,  WX12X1510,  WX12X20,  WX4X10
                         Show less",https://www.youtube.com/watch?v=d6AvOkulk_g,"This 40-Watt light bulb is sold individually and is a genuine OEM replacement option for your home appliances. It is specially designed to withstand extreme temperatures, so this bulb is compatible with a variety of appliance types including refrigerators, ranges, microwaves, and dryers. It features a frosted glass bulb with a standard metal socket base, which allows you to easily unscrew the burnt-out light and twist the new bulb into place. Depending on your appliance, there may be a guard or cover protecting the lightbulb, in which case you may require additional tools to remove the cover. We recommend disconnecting the power supply to your appliance before changing the lightbulb."
https://www.partselect.com/PS11767930-GE-WR55X26671-Light-Board-Assembly.htm?SourceCode=18,Light Board Assembly WR55X26671,PS11767930,GE,In Stock,78.91,Light not working,Refrigerator.,Really Easy,15 - 30 mins,N/A,AP6035586,https://www.youtube.com/watch?v=d6AvOkulk_g,"This is a LED light board assembly, used within refrigerators to shine light on the contents and food items within. If the light panel in your fridge is significantly dimmed or dead, it needs to be replaced immediately. To replace this light board, simply gain access to it within your fridge, disconnect and remove the wire harness from it, and slide it off its securing posts, and then place the new one in. This OEM LED light board is sold individually, so depending on how many light boards are out in your fridge, consider that before ordering."
https://www.partselect.com/PS11739347-Whirlpool-WP22002263-Light-Bulb-10W.htm?SourceCode=18,Light Bulb - 10W WP22002263,PS11739347,Whirlpool,In Stock,17.41,N/A,"Refrigerator, Dryer, Washer Dryer Combo, Wine and Beverage Cooler.",Easy,30 - 60 mins,N/A,"AP6006279,  14200559,  14201091,  14210279,  14212817,  14218420,  17512,  18445,  21074,  21120,  22002263,  245535,  262465,  263313,  28329,  3178641,  3406124,  3406125,  3406126,  35001138
                        
                            ...
                            Show more
                        
                        , 4159007,  4173328,  4323686,  4343839,  4344602,  4344740,  4350095,  4352209,  4713-001199,  528513,  550025,  790862,  790871,  8206780,  851389,  W10299463,  W10809512,  W11385701,  WP22002263VP
                         Show less",https://www.youtube.com/watch?v=Hv_tPVum9ts,This ten watt appliance light bulb is two inches tall. It is used with both washers and dryers.
https://www.partselect.com/PS12070396-Whirlpool-W11043011-LED-Light-Module.htm?SourceCode=18,LED Light Module W11043011,PS12070396,Whirlpool,In Stock,69.30,Light not working,Refrigerator.,Really Easy,Less than 15 mins,N/A,W10866538,https://www.youtube.com/watch?v=d6AvOkulk_g,"This LED light is for refrigerators.

The LED light attaches inside the cabinet and illuminates the inside of the refrigerator or freezer.

Safely store any food that could deteriorate while the power is off and unplug the refrigerator before installing this part."
https://www.partselect.com/PS12172918-GE-WR55X25754-Refrigerator-LED-Light-and-Cover-Assembly.htm?SourceCode=18,Refrigerator LED Light and Cover Assembly WR55X25754,PS12172918,GE,On Order,44.26,Light not working,Refrigerator.,N/A,N/A,N/A,"AP6261806,  WR55X26486,  WR55X30602",https://www.youtube.com/watch?v=d6AvOkulk_g,The light and cover assembly illuminates the interior of the refrigerator compartment.
https://www.partselect.com/PS12364145-Frigidaire-241779802-HINGE-MULLION.htm?SourceCode=18,HINGE-MULLION 241779802,PS12364145,Frigidaire,In Stock,38.35,Door won’t open or close,Refrigerator.,N/A,N/A,N/A,"AP6261464,  241779801,  7241779801",https://www.youtube.com/watch?v=d6AvOkulk_g,The magnet is sold separately.
https://www.partselect.com/PS3523083-LG-4620JJ2009A-Door-Stopper.htm?SourceCode=18,Door Stopper 4620JJ2009A,PS3523083,LG,In Stock,12.56,Door won’t open or close,"Refrigerator, Freezer.",Very Easy,Less than 15 mins,N/A,"AP4437762,  4620JJ2006A,  4620JJ2009A",https://www.youtube.com/watch?v=d6AvOkulk_g,"The door stop, or door stopper, is used in refrigerators. This door stop helps keep the door in position and in balance. This part is attached to the bottom of the door and it keeps it from opening and hitting the side of the refrigerator cabinet. If you find your door hits and scratches your lower cabinet when you open your fridge door, installing this part can be a solution to this problem. Make sure to unplug your appliance from the power source before installing this part and safely store food to prevent it from deteriorating. Refer to the diagram provided by the manufacturer for further instruction."
https://www.partselect.com/PS11770608-Frigidaire-5304507146-Hinge-Bearing.htm?SourceCode=18,Hinge Bearing 5304507146,PS11770608,Frigidaire,In Stock,11.59,Door won’t open or close,Refrigerator.,Really Easy,15 - 30 mins,N/A,"AP6038496,  240311201,  240527101",https://www.youtube.com/watch?v=KobJVJ2ZwnU,"This is a replacement hinge bearing for your refrigerator. The hinge bearing is found on the door hinge, and reduces friction when the door opens and closes. If the bearing is damaged, you may not be able to open or close the door properly, and in this case, it will need to be replaced. It is made of white plastic and is approximately 2 inches long and 1 inch in diameter. This part is sold individually and is a genuine OEM part."
https://www.partselect.com/PS7796195-LG-MJB62830601-STOPPER-DOOR.htm?SourceCode=18,"STOPPER,DOOR MJB62830601",PS7796195,LG,In Stock,12.56,Door won’t open or close,Refrigerator.,Very Easy,Less than 15 mins,N/A,MJB63989801,https://www.youtube.com/watch?v=d6AvOkulk_g,"This is a door stopper designed for LG refrigerators. This white plastic stopper is made to ensure the refrigerator door closes properly. If your fridge door is not closing entirely, or if this closer is damaged, it needs to be replaced to fully keep your door closed. This closer is located on the bottom of the right refrigerator door and requires a screwdriver to replace it. This closer is a genuine OEM part and is sold individually."
https://www.partselect.com/PS284979-GE-WR02X10540-Lid-Bumper.htm?SourceCode=18,Lid Bumper WR02X10540,PS284979,GE,In Stock,13.53,Noisy | Fridge too warm,"Refrigerator, Freezer, Range, Dryer.",Easy,30 - 60 mins,N/A,"AP3414570,  912732,  123C8091P002,  WR02X11329,  WR2X10540",https://www.youtube.com/watch?v=liXOlbNWFYo,"The lid bumper or evaporator fan motor bumper in your refrigerator prevents the fan motor from scraping against the side bracket. If your refrigerator/freezer is noisy, the bumper could be worn down or missing, and the sound could be a result of the motor scraping the side bracket. You will find it between the fan motor and the side bracket on the evaporator fan motor assembly. To access the bumper, you will need to remove the evaporator fan motor assembly from the freezer. This part is made of orange rubber and is less than half an inch in diameter. It has a rounded top and a slightly pointed bottom, and is sold individually."
https://www.partselect.com/PS11739042-Whirlpool-WP2182179-Lower-Door-Closing-Cam.htm?SourceCode=18,Lower Door Closing Cam WP2182179,PS11739042,Whirlpool,In Stock,9.65,Door won’t open or close | Clicking sound | Fridge too warm | Noisy,Refrigerator.,Really Easy,15 - 30 mins,N/A,"AP6005980,  2182178,  2182179,  WP2182179VP",https://www.youtube.com/watch?v=-FbNkD1MIpk,"The lower door closing cam is used in refrigerator doors, it can be located on the fresh food side or the freezer side. It helps hold the door open. This cam is made out of plastic, so it might crack or wear down over time. If your door will not open and close properly you may need to replace the door closing cam. To successfully install this part, you will need a 5/16 nut driver and a small flat blade screwdriver. Before you begin, unplug your appliance and disconnect the water supply. Lubricating this part may help with installation. This replacement part is sold individually. This part will fit both the left and right side of your refrigerator door. To make the repair, remove the top hinge cover, then the top hinge support. Lift the door from the bottom support and remove the old door cams. Replace the cams, using a little lubricant if necessary, and place the door back on the lower hinge support. Replace the top hinge support and your repair is complete!"
https://www.partselect.com/PS2358752-Frigidaire-241779401-Upper-or-Lower-Mullion-Hinge-Pin.htm?SourceCode=18,Upper or Lower Mullion Hinge Pin 241779401,PS2358752,Frigidaire,In Stock,24.91,Door won’t open or close | Door Sweating,Refrigerator.,Very Easy,15 - 30 mins,N/A,"AP4393564,  7241779401",https://www.youtube.com/watch?v=d6AvOkulk_g,"This mullion hinge pin is a genuine OEM replacement part, measuring 1.5 inches by 1.25 inches by 0.85 inches. It is specially designed to secure the mullion in refrigerators, allowing it to pivot and ensure smooth door movement. The mullion acts as a barrier between the refrigerator and freezer to maintain the desired temperatures for each section. A damaged or loose hinge pin will result in temperature fluctuations, frost buildup along the door edges, and difficulties opening and closing the door. Therefore, it is important that you replace the pin as soon as it is no longer functioning. Note that your appliance may require two hinge pins, one near the top of the mullion and one near the bottom. Remove the mullion cover, detach the hinge pin, and install a the new one into the hinge assembly. Place the cover back on and verify that the hinge assembly is working by carefully opening and closing the refrigerator doors to check that they are moving smoothly. Each sold individually."
https://www.partselect.com/PS976452-Frigidaire-240328203-Hinge-Bearing.htm?SourceCode=18,Hinge Bearing 240328203,PS976452,Frigidaire,In Stock,28.75,Clicking sound | Door won’t open or close | Noisy | Door Sweating,Refrigerator.,Really Easy,15 - 30 mins,N/A,"AP3757897,  1056737,  7240328203",https://www.youtube.com/watch?v=0GScyyhX-Cs,Sold individually.
https://www.partselect.com/PS11755285-Whirlpool-WPW10470155-CAM-DOOR.htm?SourceCode=18,CAM-DOOR WPW10470155,PS11755285,Whirlpool,In Stock,9.65,Door won’t open or close | Clicking sound,Refrigerator.,A Bit Difficult,1- 2 hours,N/A,"AP6021957,  W10397037,  W10470155",https://www.youtube.com/watch?v=BV240RDp0I4,N/A
https://www.partselect.com/PS11752991-Whirlpool-WPW10329686-Door-Cam-Black.htm?SourceCode=18,Door Cam - Black WPW10329686,PS11752991,Whirlpool,In Stock,9.65,Door won’t open or close | Clicking sound | Fridge too warm | Noisy,"Refrigerator, Freezer.",Really Easy,15 - 30 mins,N/A,"AP6019682,  1115901,  2155309,  2155310,  2155311,  2159138,  986759,  W10329686,  WPW10329686VP",https://www.youtube.com/watch?v=pJhRoiDHrU4,"The Door Cam is a black plastic part which helps the door pivot shut while keeping the door and hinge in proper alignment. Lubricating this part upon installation may help it move easier.  It attaches onto the door hinge and should be replaced if broken or if there is noticeable damage. Refer to your model number and user manual to ensure this is the correct part for you. To do this repair you will need a 5/6 nut driver, a 5/16 socket, and a ratchet. For safety purposes, do not forget to turn off your appliance before making this repair. Note that this piece is black, and as per the manufacturer requires a new screw to mount the door cam which is sold individually. Please also note that this is the closing cam for the lower door, and the upper door cam is sold as a separate kit."
https://www.partselect.com/PS1964648-Whirlpool-W10169313-Door-Switch-Kit.htm?SourceCode=18,Door Switch Kit W10169313,PS1964648,Whirlpool,In Stock,21.51,Won’t Start | Noisy,"Dryer, Washer, Washer Dryer Combo, Refrigerator.",Really Easy,15 - 30 mins,N/A,"AP4319999,  1378530,  3-4575,  3-4576,  3-5753,  3-5754,  304575,  304576,  305753,  305754,  33001508,  33001509,  5-4570,  504570,  56052,  57012,  62872,  R0602515,  W10169313,  W10169313VP
                        
                            ...
                            Show more
                        
                        , WPY304575,  Y304575,  Y304576,  Y305753,  Y305754,  Y504570,  Y62872
                         Show less",https://www.youtube.com/watch?v=apRejN1uTO8,"This part replaces two terminal switches in a dryer and prevents the dryer from running when the door is open. This includes two connectors. If your dryer will not shut off, start, or does not tumble, replacing the door switch can solve this appliance problem. The tools needed for replacement are a screw driver and wire strippers. Make sure to attach the two wires to the right two poles of the new switch, to do this you can check the resistance of the switch. Unplug the dryer before installing this part, also refer to the diagram provided by the manufacturer."
https://www.partselect.com/PS1483583-GE-WR62X10055-Dispenser-Door-Solenoid-Assembly.htm?SourceCode=18,Dispenser Door Solenoid Assembly WR62X10055,PS1483583,GE,In Stock,51.79,Ice maker won’t dispense ice | Not dispensing water | Door won’t open or close | Door Sweating,Refrigerator.,Easy,30 - 60 mins,N/A,"AP3963333,  1194707,  WR62X10055,  203C6017G001,  WR62X10020",https://www.youtube.com/watch?v=z_s7GJsQkr0,This part is a possible option when ice door won't open or shut properly or when water is not dispensing.
