url,title,part_id,brand,availability,price,symptoms,product_types,installation_difficulty,installation_time,related_parts,replacement_parts,video_url,description,rating
https://www.partselect.com/PS734936-Frigidaire-240534701-Door-Shelf-Retainer-Bar.htm?SourceCode=18,Door Shelf Retainer Bar 240534701,PS734936,Frigidaire,In Stock,51.05,Door won’t open or close,Refrigerator.,Really Easy,Less than 15 mins,Door Shelf Retainer Bar (https://www.partselect.com/PS734935-Frigidaire-240534901-Door-Shelf-Retainer-Bar.htm?SourceCode=14) | Affresh Washing Machine Cleaner - 3 pack (https://www.partselect.com/PS1960673-Whirlpool-W10135699-Affresh-Washing-Machine-Cleaner-3-pack.htm?SourceCode=14) | Affresh Dishwasher Cleaner Tablets - 6 (https://www.partselect.com/PS12345667-Whirlpool-W10549851-Affresh-Dishwasher-Cleaner-Tablets-6.htm?SourceCode=14) | Affresh Washing Machine Cleaner Tablets – 6 Count (https://www.partselect.com/PS12345661-Whirlpool-W10501250-Affresh-Washing-Machine-Cleaner-Tablets-6-Count.htm?SourceCode=14) | Produce Preserver Filter (https://www.partselect.com/PS3503014-Whirlpool-W10346771A-Produce-Preserver-Filter.htm?SourceCode=14) | Cooktop Cleaner (https://www.partselect.com/PS3492527-Whirlpool-W10355051-Cooktop-Cleaner.htm?SourceCode=14) | Refrigerator Deodorizer (https://www.partselect.com/PS12739141-LG-MCS62101805-Refrigerator-Deodorizer.htm?SourceCode=14),"AP3214631,  948952,  240534701",https://www.youtube.com/watch?v=JGlCNEgLfM0,"The Door Shelf Retainer Bar, also known as a refrigerator door rack, is a white, plastic part which can be easily installed onto your fridge door.  It holds items in your fridge and will show physical damage if broken, at which time it should be replaced. Check your user manual and model number to see if this part is right for you. To install this part, you will need to remove the old one by unlocking the tabs, which can be slid with your fingers. To install the new shelf, line it up with the shelf cut-outs, over the tabs, and gently press it down to lock it into place. This part generally fits the middle door shelf of refrigerators. This is a part that frequently requires multiple parts per refrigerator. Because it is sold individually, you will need to purchase as many door racks as necessary to complete your repair.",N/A
https://www.partselect.com/PS11701542-Whirlpool-EDR1RXD1-Refrigerator-Ice-and-Water-Filter.htm?SourceCode=18,Refrigerator Ice and Water Filter EDR1RXD1,PS11701542,Whirlpool,In Stock,74.21,Not dispensing water | Ice maker not making ice | Ice maker won’t dispense ice | Leaking,Refrigerator.,Really Easy,15 - 30 mins,Refrigerator Air Filter (https://www.partselect.com/PS2580853-Whirlpool-W10311524-Refrigerator-Air-Filter.htm?SourceCode=14) | Affresh Washing Machine Cleaner - 3 pack (https://www.partselect.com/PS1960673-Whirlpool-W10135699-Affresh-Washing-Machine-Cleaner-3-pack.htm?SourceCode=14) | Affresh Dishwasher Cleaner Tablets - 6 (https://www.partselect.com/PS12345667-Whirlpool-W10549851-Affresh-Dishwasher-Cleaner-Tablets-6.htm?SourceCode=14) | Affresh Washing Machine Cleaner Tablets – 6 Count (https://www.partselect.com/PS12345661-Whirlpool-W10501250-Affresh-Washing-Machine-Cleaner-Tablets-6-Count.htm?SourceCode=14) | Produce Preserver Filter (https://www.partselect.com/PS3503014-Whirlpool-W10346771A-Produce-Preserver-Filter.htm?SourceCode=14) | Cooktop Cleaner (https://www.partselect.com/PS3492527-Whirlpool-W10355051-Cooktop-Cleaner.htm?SourceCode=14) | Refrigerator Deodorizer (https://www.partselect.com/PS12739141-LG-MCS62101805-Refrigerator-Deodorizer.htm?SourceCode=14),"AP5982535,  9900,  9981,  EDR1RXD1B,  FILTER 1,  FILTER1,  W10217316,  W10291030,  W10295370,  W10295370A,  W10569758,  W10569760,  W10569761,  W10735398",https://www.youtube.com/watch?v=d6AvOkulk_g,"The EDR1RXD1 water filter provides clean, fresh-tasting water by reducing contaminants such as lead, chlorine, and particulates. Designed for easy installation, this filter ensures your refrigerator water and ice are safe and refreshing with every use",N/A
https://www.partselect.com/PS12364199-Frigidaire-242126602-Refrigerator-Door-Shelf-Bin.htm?SourceCode=18,Refrigerator Door Shelf Bin 242126602,PS12364199,Frigidaire,In Stock,43.00,N/A,Refrigerator.,Really Easy,15 - 30 mins,Affresh Washing Machine Cleaner - 3 pack (https://www.partselect.com/PS1960673-Whirlpool-W10135699-Affresh-Washing-Machine-Cleaner-3-pack.htm?SourceCode=14) | Affresh Dishwasher Cleaner Tablets - 6 (https://www.partselect.com/PS12345667-Whirlpool-W10549851-Affresh-Dishwasher-Cleaner-Tablets-6.htm?SourceCode=14) | Affresh Washing Machine Cleaner Tablets – 6 Count (https://www.partselect.com/PS12345661-Whirlpool-W10501250-Affresh-Washing-Machine-Cleaner-Tablets-6-Count.htm?SourceCode=14) | Produce Preserver Filter (https://www.partselect.com/PS3503014-Whirlpool-W10346771A-Produce-Preserver-Filter.htm?SourceCode=14) | Cooktop Cleaner (https://www.partselect.com/PS3492527-Whirlpool-W10355051-Cooktop-Cleaner.htm?SourceCode=14) | Refrigerator Deodorizer (https://www.partselect.com/PS12739141-LG-MCS62101805-Refrigerator-Deodorizer.htm?SourceCode=14),AP6278233,https://www.youtube.com/watch?v=d6AvOkulk_g,"This manufacturer-certified Refrigerator Door Shelf Bin, also known as a crisper bin or door shelf bin, is made of clear plastic, and is easy to install. It is used to hold items in the fridge, like jars, cans, and condiments and you'll be able to visually see if the part is broken or cracked. This particular shelf attaches to the fridge door. You can check if this model is right for your appliance by checking your user manual and model number. This part should simply snap into place without the need for any tools as part of the repair. Just carefully line up the slots on the door with the slots on the bin and slide the bin down to completely lock it into place. The part is sold individually, and fits many different types of side-by-side refrigerators.",N/A
https://www.partselect.com/PS11752778-Whirlpool-WPW10321304-Refrigerator-Door-Shelf-Bin.htm?SourceCode=18,Refrigerator Door Shelf Bin WPW10321304,PS11752778,Whirlpool,In Stock,41.23,Door won’t open or close | Ice maker won’t dispense ice | Leaking,Refrigerator.,Really Easy,Less than 15 mins,Refrigerator Crisper Drawer with Humidity Control (https://www.partselect.com/PS11739119-Whirlpool-WP2188656-Refrigerator-Crisper-Drawer-with-Humidity-Control.htm?SourceCode=14) | Affresh Washing Machine Cleaner - 3 pack (https://www.partselect.com/PS1960673-Whirlpool-W10135699-Affresh-Washing-Machine-Cleaner-3-pack.htm?SourceCode=14) | Affresh Dishwasher Cleaner Tablets - 6 (https://www.partselect.com/PS12345667-Whirlpool-W10549851-Affresh-Dishwasher-Cleaner-Tablets-6.htm?SourceCode=14) | Affresh Washing Machine Cleaner Tablets – 6 Count (https://www.partselect.com/PS12345661-Whirlpool-W10501250-Affresh-Washing-Machine-Cleaner-Tablets-6-Count.htm?SourceCode=14) | Produce Preserver Filter (https://www.partselect.com/PS3503014-Whirlpool-W10346771A-Produce-Preserver-Filter.htm?SourceCode=14) | Cooktop Cleaner (https://www.partselect.com/PS3492527-Whirlpool-W10355051-Cooktop-Cleaner.htm?SourceCode=14) | Refrigerator Deodorizer (https://www.partselect.com/PS12739141-LG-MCS62101805-Refrigerator-Deodorizer.htm?SourceCode=14),"AP6019471,  2171046,  2171047,  2179574,  2179575,  2179607,  2179607K,  2198449,  2198449K,  2304235,  2304235K,  W10321302,  W10321303,  W10321304,  W10549739,  WPW10321304VP",https://www.youtube.com/watch?v=zSCNN6KpDE8,"This refrigerator door bin is a genuine OEM replacement designed to fit many side-by-side refrigerator models. Compatible with brands like KitchenAid, Maytag, and Amana, it attaches to the interior door, providing storage for jars and bottles. Featuring a clear design with white trim, this bin is both durable and functional. Installation is tool-free—simply align and snap into place. Verify your refrigerator’s model number before ordering to ensure compatibility, as dimensions may vary slightly. Restore your refrigerator's storage capacity and organization with this high-quality replacement door bin.",N/A
https://www.partselect.com/PS734935-Frigidaire-240534901-Door-Shelf-Retainer-Bar.htm?SourceCode=18,Door Shelf Retainer Bar 240534901,PS734935,Frigidaire,In Stock,47.36,Door won’t open or close | Leaking,Refrigerator.,Really Easy,Less than 15 mins,Door Shelf Retainer Bar (https://www.partselect.com/PS734936-Frigidaire-240534701-Door-Shelf-Retainer-Bar.htm?SourceCode=14) | Freezer Door Shelf Retainer Bar (https://www.partselect.com/PS734937-Frigidaire-240534801-Freezer-Door-Shelf-Retainer-Bar.htm?SourceCode=14) | Affresh Washing Machine Cleaner - 3 pack (https://www.partselect.com/PS1960673-Whirlpool-W10135699-Affresh-Washing-Machine-Cleaner-3-pack.htm?SourceCode=14) | Affresh Dishwasher Cleaner Tablets - 6 (https://www.partselect.com/PS12345667-Whirlpool-W10549851-Affresh-Dishwasher-Cleaner-Tablets-6.htm?SourceCode=14) | Affresh Washing Machine Cleaner Tablets – 6 Count (https://www.partselect.com/PS12345661-Whirlpool-W10501250-Affresh-Washing-Machine-Cleaner-Tablets-6-Count.htm?SourceCode=14) | Produce Preserver Filter (https://www.partselect.com/PS3503014-Whirlpool-W10346771A-Produce-Preserver-Filter.htm?SourceCode=14) | Cooktop Cleaner (https://www.partselect.com/PS3492527-Whirlpool-W10355051-Cooktop-Cleaner.htm?SourceCode=14) | Refrigerator Deodorizer (https://www.partselect.com/PS12739141-LG-MCS62101805-Refrigerator-Deodorizer.htm?SourceCode=14),"AP3214630,  948954,  240534901",https://www.youtube.com/watch?v=RBJ10wFvJ2M,"This door shelf retaining bar, also known as refrigerator door bar retainer or fridge door rack, is a genuine part sourced from the original manufacturer. It is a white This manufacturer-certified Door Shelf Retainer Bar, sometimes otherwise known as the door rack or bar retainer,  is a white, plastic part which can be easily installed onto the inside of the refrigerator or freezer door to hold items on the door shelves.  It holds items in your fridge and will show physical damage if broken or warped, at which time it should be replaced. Check your user manual and model number to see if this part is right for you. No tools are required for this installation, the part should simply snap into place. This part measures roughly 25 inches wide, 3 inches high, and 5 inches deep. This part is sold individually, and we recommend checking the other door shelf retaining bars on your refrigerator or freezer at the same time as ordering this part to ensure that no others need to be replaced, as they often wear or warp at similar speeds.",N/A
https://www.partselect.com/PS10065979-Whirlpool-W10712395-Upper-Rack-Adjuster-Kit-White-Wheels-Left-and-Right-Sides.htm?SourceCode=18,"Upper Rack Adjuster Kit - White Wheels, Left and Right Sides W10712395",PS10065979,Whirlpool,In Stock,49.86,Door won’t close | Door latch failure | Not cleaning dishes properly | Noisy,Dishwasher.,Really Easy,30 - 60 mins,Rack Track Stop (https://www.partselect.com/PS11746591-Whirlpool-WP8565925-Rack-Track-Stop.htm?SourceCode=14) | Affresh Washing Machine Cleaner - 3 pack (https://www.partselect.com/PS1960673-Whirlpool-W10135699-Affresh-Washing-Machine-Cleaner-3-pack.htm?SourceCode=14) | Affresh Dishwasher Cleaner Tablets - 6 (https://www.partselect.com/PS12345667-Whirlpool-W10549851-Affresh-Dishwasher-Cleaner-Tablets-6.htm?SourceCode=14) | Affresh Washing Machine Cleaner Tablets – 6 Count (https://www.partselect.com/PS12345661-Whirlpool-W10501250-Affresh-Washing-Machine-Cleaner-Tablets-6-Count.htm?SourceCode=14) | Produce Preserver Filter (https://www.partselect.com/PS3503014-Whirlpool-W10346771A-Produce-Preserver-Filter.htm?SourceCode=14) | Cooktop Cleaner (https://www.partselect.com/PS3492527-Whirlpool-W10355051-Cooktop-Cleaner.htm?SourceCode=14) | Refrigerator Deodorizer (https://www.partselect.com/PS12739141-LG-MCS62101805-Refrigerator-Deodorizer.htm?SourceCode=14),"AP5957560,  W10250159,  W10350375,  W10712395VP",https://www.youtube.com/watch?v=pZO1rcMwKBc,"This authentic Dishwasher Upper Rack Adjuster Kit with white wheels is a kit made up of primarily plastic and metal components, which will require a screwdriver to install. This kit comes with all the necessary parts for a dishwasher rack adjuster.  It fits onto the dishwasher rack and connects it to the track allowing it to slide in and out. If broken then the rack will no longer slide properly, and the part must be replaced. In many cases, our customers have reported the top rack of their dishwasher hanging down or sagging due to the adjuster kit, particularly if the wheels, have broken or failed. If you are having problems in this area, this kit will help get your dishwasher back up and running. Check your model number and user manual to see if this part is right for you. The parts for this kit come as a package and are not generally sold individually.",N/A
https://www.partselect.com/PS11746591-Whirlpool-WP8565925-Rack-Track-Stop.htm?SourceCode=18,Rack Track Stop WP8565925,PS11746591,Whirlpool,In Stock,9.65,Door latch failure | Not cleaning dishes properly | Door won’t close,Dishwasher.,Really Easy,30 - 60 mins,Affresh Washing Machine Cleaner - 3 pack (https://www.partselect.com/PS1960673-Whirlpool-W10135699-Affresh-Washing-Machine-Cleaner-3-pack.htm?SourceCode=14) | Affresh Dishwasher Cleaner Tablets - 6 (https://www.partselect.com/PS12345667-Whirlpool-W10549851-Affresh-Dishwasher-Cleaner-Tablets-6.htm?SourceCode=14) | Affresh Washing Machine Cleaner Tablets – 6 Count (https://www.partselect.com/PS12345661-Whirlpool-W10501250-Affresh-Washing-Machine-Cleaner-Tablets-6-Count.htm?SourceCode=14) | Produce Preserver Filter (https://www.partselect.com/PS3503014-Whirlpool-W10346771A-Produce-Preserver-Filter.htm?SourceCode=14) | Cooktop Cleaner (https://www.partselect.com/PS3492527-Whirlpool-W10355051-Cooktop-Cleaner.htm?SourceCode=14) | Refrigerator Deodorizer (https://www.partselect.com/PS12739141-LG-MCS62101805-Refrigerator-Deodorizer.htm?SourceCode=14),"AP6013365,  8270105,  8270106,  8524581,  8524582,  8562015,  8565920,  8565925,  W10082860,  W10082861,  W10199682,  W10508950,  WP8565925VP,  WPW10082861VP,  WPW10508950,  WPW10508950VP",https://www.youtube.com/watch?v=siE-8HethWg,"The rack track stop on your dishwasher is designed to stop the dish rack at the appropriate place when opening and closing the rack. If your dishwasher is not cleaning your dishes properly, the rack stop may need to be replaced. The replacement part may differ slightly from the broken part, depending on the model. However, the different styles are interchangeable. This product is sold individually and comes in both a white and grey plastic version. Many of our customers found this repair to be very easy and takes less than 30 minutes to complete. Simply snap the old part out and snap the new part into place. You will not require any tools to complete the job. This is an authentic part approved by the manufacturer.",N/A
https://www.partselect.com/PS11750057-Whirlpool-WPW10195417-Lower-Dishrack-Wheel-Assembly.htm?SourceCode=18,Lower Dishrack Wheel Assembly WPW10195417,PS11750057,Whirlpool,In Stock,42.36,Door won’t close | Door latch failure | Not cleaning dishes properly,Dishwasher.,Really Easy,Less than 15 mins,Affresh Washing Machine Cleaner - 3 pack (https://www.partselect.com/PS1960673-Whirlpool-W10135699-Affresh-Washing-Machine-Cleaner-3-pack.htm?SourceCode=14) | Affresh Dishwasher Cleaner Tablets - 6 (https://www.partselect.com/PS12345667-Whirlpool-W10549851-Affresh-Dishwasher-Cleaner-Tablets-6.htm?SourceCode=14) | Affresh Washing Machine Cleaner Tablets – 6 Count (https://www.partselect.com/PS12345661-Whirlpool-W10501250-Affresh-Washing-Machine-Cleaner-Tablets-6-Count.htm?SourceCode=14) | Produce Preserver Filter (https://www.partselect.com/PS3503014-Whirlpool-W10346771A-Produce-Preserver-Filter.htm?SourceCode=14) | Cooktop Cleaner (https://www.partselect.com/PS3492527-Whirlpool-W10355051-Cooktop-Cleaner.htm?SourceCode=14) | Refrigerator Deodorizer (https://www.partselect.com/PS12739141-LG-MCS62101805-Refrigerator-Deodorizer.htm?SourceCode=14),"AP6016764,  W10195417,  WPW10195417VP",https://www.youtube.com/watch?v=d6AvOkulk_g,"This gray plastic lower dishrack roller is a part for your dishwasher. It attaches to the bottom of the lower dishrack, allowing it to move in and out smoothly. If the lower dishrack stops moving in and out easily or preventing you from being able to shut the dishwasher door, inspect the dishrack roller for damage. The assembly includes 2 rollers and the bracket that attaches to the dishrack (parts are not sold separately). This assembly is sold individually, so you will need 4 assemblies to replace them all in your appliance. For this easy repair, start by removing the lower dishrack from the appliance and set it on the counter. Use a screwdriver to pry off the old roller assembly from the lower tabs. Align the new part on the dishrack by snapping it in place.",N/A
https://www.partselect.com/PS3406971-Whirlpool-W10195416-Lower-Dishrack-Wheel.htm?SourceCode=18,Lower Dishrack Wheel W10195416,PS3406971,Whirlpool,In Stock,46.00,Not cleaning dishes properly | Door won’t close | Noisy | Door latch failure,Dishwasher.,Very Easy,15 - 30 mins,Affresh Washing Machine Cleaner - 3 pack (https://www.partselect.com/PS1960673-Whirlpool-W10135699-Affresh-Washing-Machine-Cleaner-3-pack.htm?SourceCode=14) | Affresh Dishwasher Cleaner Tablets - 6 (https://www.partselect.com/PS12345667-Whirlpool-W10549851-Affresh-Dishwasher-Cleaner-Tablets-6.htm?SourceCode=14) | Affresh Washing Machine Cleaner Tablets – 6 Count (https://www.partselect.com/PS12345661-Whirlpool-W10501250-Affresh-Washing-Machine-Cleaner-Tablets-6-Count.htm?SourceCode=14) | Produce Preserver Filter (https://www.partselect.com/PS3503014-Whirlpool-W10346771A-Produce-Preserver-Filter.htm?SourceCode=14) | Cooktop Cleaner (https://www.partselect.com/PS3492527-Whirlpool-W10355051-Cooktop-Cleaner.htm?SourceCode=14) | Refrigerator Deodorizer (https://www.partselect.com/PS12739141-LG-MCS62101805-Refrigerator-Deodorizer.htm?SourceCode=14),"W10195416V,  W10195416VP",https://www.youtube.com/watch?v=fz1YHu782Wk,"This OEM gray Dishwasher Lower Dishrack Wheel Assembly is a plastic kit that allows the rack to slide in and out of the dishwasher easily. If it breaks or becomes damaged. sliding will feel difficult. This can happen due to normal wear and tear, and the part should be replaced if this occurs. Check your model number and user manual to make sure this part is correct. It attaches directly to the dishrack. To repair, open the dishwasher door and pull out the lower dishrack. Next, push the tab from both sides and it should pop out. To install the new wheel assembly, place it on the rack and make sure the caps overlap the wire from the inside before you clip it in place by pushing the wheel. It measures roughly 3x6 inches.",N/A
https://www.partselect.com/PS11756150-Whirlpool-WPW10546503-Dishwasher-Upper-Rack-Adjuster.htm?SourceCode=18,Dishwasher Upper Rack Adjuster WPW10546503,PS11756150,Whirlpool,In Stock,43.81,Door won’t close | Door latch failure | Not cleaning dishes properly | Leaking,Dishwasher.,Really Easy,30 - 60 mins,Affresh Washing Machine Cleaner - 3 pack (https://www.partselect.com/PS1960673-Whirlpool-W10135699-Affresh-Washing-Machine-Cleaner-3-pack.htm?SourceCode=14) | Affresh Dishwasher Cleaner Tablets - 6 (https://www.partselect.com/PS12345667-Whirlpool-W10549851-Affresh-Dishwasher-Cleaner-Tablets-6.htm?SourceCode=14) | Affresh Washing Machine Cleaner Tablets – 6 Count (https://www.partselect.com/PS12345661-Whirlpool-W10501250-Affresh-Washing-Machine-Cleaner-Tablets-6-Count.htm?SourceCode=14) | Produce Preserver Filter (https://www.partselect.com/PS3503014-Whirlpool-W10346771A-Produce-Preserver-Filter.htm?SourceCode=14) | Cooktop Cleaner (https://www.partselect.com/PS3492527-Whirlpool-W10355051-Cooktop-Cleaner.htm?SourceCode=14) | Refrigerator Deodorizer (https://www.partselect.com/PS12739141-LG-MCS62101805-Refrigerator-Deodorizer.htm?SourceCode=14),"AP6022813,  W10306646,  W10418314,  W10546502,  W10546503,  W10911100,  WPW10546503VP",https://www.youtube.com/watch?v=d6AvOkulk_g,"This OEM Dishwasher Upper Rack Adjuster is a grayish-black, plastic part which will require a screwdriver to install.  It fits onto the dishwasher rack and connects it to the track allowing it to slide in and out. If broken then the rack will no longer slide properly, and the part must be replaced. The installation has been rated as ""easy"" by customers. Before beginning any repair, you should unplug the dishwasher and wear gloves to protect your hands. Check your model number and user manual to see if this part is right for you! Your dishwasher should have a left and right upper rack adjuster, and both are the same part. These parts are sold individually, so if you are looking to replace both, you will need to order two parts.",N/A
https://www.partselect.com/PS429724-Frigidaire-240323001-Refrigerator-Door-Bin.htm?SourceCode=18,Refrigerator Door Bin 240323001,PS429724,Frigidaire,In Stock,33.55,Ice maker not making ice | Door won’t open or close | Noisy | Ice maker won’t dispense ice,Refrigerator.,Easy,Less than 15 mins,N/A,"AP2115741,  890954,  240323001,  240323001,  240323007",https://www.youtube.com/watch?v=d6AvOkulk_g,"This door bin (Bottom Door Bin, Refrigerator Door Bin, Door Shelf Bin, Refrigerator Door Bin) is a movable bin mounted on the inner door to hold food items, bottles, and jars. Over time, a cold refrigerator can cause plastic to become fragile and break down. This can lead to other issues in the refrigerator. When the door bin will not hold securely onto the inner door panel, it must be replaced. This door bin measures 5.75 inches high, 16 inches wide, by 4.25 inches deep and is made of white plastic. Sold individually."
https://www.partselect.com/PS430122-Frigidaire-240356402-Door-Bin-Clear.htm?SourceCode=18,Door Bin - Clear 240356402,PS430122,Frigidaire,In Stock,87.27,N/A,Refrigerator.,Really Easy,15 - 30 mins,N/A,"AP2549958,  891214,  240356402,  240356407,  240356408,  240356410,  240356411,  240356413,  240356414,  240356415,  240356416,  240430305,  240430307,  240430311,  240430312,  240430325,  241808205,  241808206,  241808221,  241808229",https://www.youtube.com/watch?v=d6AvOkulk_g,"This bin can be moved according to space needed.  It holds items on the door of your refrigerator. 

NOTE: This bin is only available in clear plastic now."
https://www.partselect.com/PS735091-Frigidaire-240535101-Door-Rack.htm?SourceCode=18,Door Rack 240535101,PS735091,Frigidaire,In Stock,36.43,Door won’t open or close,Refrigerator.,Really Easy,Less than 15 mins,N/A,"AP3214801,  948956,  240535101",https://www.youtube.com/watch?v=_DIkHXz_0oU,"The Door Rack (also known as a retainer bar) is a 23"" white plastic part used to hold small items inside the fridge door. If broken, it should be replaced. Refer to your user manual and model number to determine if this part is correct for you. This is a simple part to repair and should not require any tools. Most customers found it to be very easy to simply snap the old rack out of place and snap the new one back in, making sure the locking tabs are secure. This part is sold individually and not as a part of a kit. It is certified by the original manufacturer."
https://www.partselect.com/PS429868-Frigidaire-240337901-Refrigerator-Door-Shelf-Retainer-Bin.htm?SourceCode=18,Refrigerator Door Shelf Retainer Bin 240337901,PS429868,Frigidaire,In Stock,47.36,Door won’t open or close | Noisy | Touchpad does not respond,Refrigerator.,Really Easy,Less than 15 mins,N/A,"AP2115858,  891047,  240337901,  240337904,  240337905",https://www.youtube.com/watch?v=nr8TPEghgjs,"This refrigerator door shelf attaches to the inside of the refrigerator door, typically holds jars and bottles, The manufacturer-approved Refrigerator Door Shelf Retainer Bar, sometimes known as the door rack or bar retainer, is a white, plastic part which can be easily installed onto your fridge door. Just snap the old part up and out of place, and push to snap the new part in its place.  This part holds items in your fridge like jars and bottles and will show physical damage if broken, at which time it should be replaced. Check your user manual and model number to see if this part is right for you, as there are likely to be several different sizes and part numbers for the various different door racks in your fridge. You want to make sure you've selected the right one!  This part is 24.25 inches wide and 3.75 inches deep and features open square latches. This part is sold individually."
https://www.partselect.com/PS429871-Frigidaire-240338001-Refrigerator-Door-Shelf-Bin.htm?SourceCode=18,Refrigerator Door Shelf Bin 240338001,PS429871,Frigidaire,In Stock,50.84,Door won’t open or close | Noisy,Refrigerator.,Really Easy,Less than 15 mins,N/A,"AP2115859,  891049,  240338001,  240338005",https://www.youtube.com/watch?v=G-A1YKp0o0o,"This manufacturer-approved Refrigerator Door Shelf Bin is made of white plastic and is easy to install. It is used to hold heavier items in the fridge, and you'll be able to visually see if the part is broken. This particular shelf attaches to the fridge door and is designed for the UPPER shelf. You can check if this model is right for your appliance by checking your user manual and model number. This model is just over 26"" wide, just over 4"" tall and just over 7"" deep - front to back. This is a simple repair that requires only that you snap the old part out of place and snap the new one into place."
